{
  "enabled": true,
  "trigger_mode": "manual",
  "profile": "legal-writer",
  "industry": "legal",
  "enhance_mode": "standard",
  "gateway_base_url": "https://skillflux.cn",
  "session": {
    "strategy": "agent-task",
    "ttl_seconds": 1800
  },
  "checks": {
    "enabled": true,
    "max_runtime_ms": 800
  }
}
